{
  "id": 33,
  "name": "watmel",
  "growth_time": 15,
  "max_harvest": 15,
  "natural_gift_power": 80,
  "size": 250,
  "smoothness": 35,
  "soil_dryness": 8,
  "firmness": {
    "name": "soft",
    "url": "/api/v2/berry-firmness/2/"
  },
  "flavors": [
    {
      "potency": 0,
      "flavor": {
        "name": "spicy",
        "url": "/api/v2/berry-flavor/1/"
      }
    },
    {
      "potency": 0,
      "flavor": {
        "name": "dry",
        "url": "/api/v2/berry-flavor/2/"
      }
    },
    {
      "potency": 30,
      "flavor": {
        "name": "sweet",
        "url": "/api/v2/berry-flavor/3/"
      }
    },
    {
      "potency": 10,
      "flavor": {
        "name": "bitter",
        "url": "/api/v2/berry-flavor/4/"
      }
    },
    {
      "potency": 0,
      "flavor": {
        "name": "sour",
        "url": "/api/v2/berry-flavor/5/"
      }
    }
  ],
  "item": {
    "name": "watmel-berry",
    "url": "/api/v2/item/158/"
  },
  "natural_gift_type": {
    "name": "fire",
    "url": "/api/v2/type/10/"
  }
}